{"campaign":{"campaign_id":"luremandate-conformance-v1","environment":{"environment_id":"federal-research-sandbox","tenant_id":"agency-tenant"},"run_id":"mandate-run-1"},"checks":[{"check_id":"semantic_verification_recomputed","status":"pass"},{"check_id":"authenticated_approval_evidence_recomputed","status":"pass"},{"check_id":"body_free_telemetry_projection_recomputed","status":"pass"},{"check_id":"telemetry_source_signature_authenticated","status":"pass"},{"check_id":"exact_plan_run_and_evaluation_binding","status":"pass"},{"check_id":"preregistered_approver_key_policy","status":"pass"},{"check_id":"externally_pinned_approver_keys","status":"pass"},{"check_id":"deployment_engine_identity_matches_policy","status":"pass"},{"check_id":"run_freshness_matches_policy","status":"pass"},{"check_id":"transaction_authority_acceptance_met","status":"pass"}],"contract":{"engine":{"engine_artifact_sha256":"aaaaaaaaaaaaaaaaaaaaaaaaaaaaaaaaaaaaaaaaaaaaaaaaaaaaaaaaaaaaaaaa","engine_id":"luremandate-reference","engine_version":"1.0.0"},"evaluation_document_sha256":"e376912c69266d3272cdf1968e3e21913645b3e59afb1651ebe7a66dc5a0673c","evaluation_sha256":"e376912c69266d3272cdf1968e3e21913645b3e59afb1651ebe7a66dc5a0673c","plan_document_sha256":"034d002b81c30e2ceeb6690c643828874cde8e1c1769015a82402c2cad401641","plan_sha256":"034d002b81c30e2ceeb6690c643828874cde8e1c1769015a82402c2cad401641","receiver":{"artifact_sha256":"aaaaaaaaaaaaaaaaaaaaaaaaaaaaaaaaaaaaaaaaaaaaaaaaaaaaaaaaaaaaaaaa","instance_id":"authority-gateway-instance-1","name":"luremandate-reference","version":"1.0.0"},"run_document_sha256":"a61fcdb1d7289ae2daf3faa06033e72cfc46b2618bc0a56a5ab5f79e2cc55562","run_sha256":"a61fcdb1d7289ae2daf3faa06033e72cfc46b2618bc0a56a5ab5f79e2cc55562"},"created_at":"2026-09-05T15:21:00Z","gate_id":"luremandate-conformance-gate","interpretation_boundary":"Pass means an independently reproduced transaction-authority evaluation, authenticated P-256 approval statements, and an independently reconstructed body-free telemetry export authenticated by an externally pinned receiver key bind the same exact plan, run, and producer evaluation. Every approval key fingerprint matches a preregistered caller-supplied policy, and the run matches caller-supplied engine, receiver-instance, and freshness policy. It does not establish trusted identity proofing, key custody, trusted time, telemetry completeness, effect-sensor authenticity, complete mediation, legal authority, compliance, safety, or deployment authorization.","limitations":["gate_reconciles_submitted_semantic_approval_signature_and_receiver_signed_body_free_telemetry_evidence_only","approver_key_policy_is_caller_supplied_and_requires_separately_governed_authorization","key_fingerprints_do_not_prove_identity_proofing_hardware_backing_key_custody_or_revocation","receiver_signature_does_not_prove_telemetry_completeness_clock_sync_delivery_or_non_bypassable_instrumentation","effect_observations_sensor_identity_and_complete_runtime_mediation_remain_external_claims","impact_units_roles_thresholds_and_legal_authority_require_organization_specific_governance","a_pass_is_not_compliance_certification_safety_legal_authority_or_deployment_authorization"],"overall_status":"pass","policy":{"approver_key_policy_id":"luremandate-conformance-key-policy","approver_key_policy_sha256":"8b22d62d880e3a6191d236a3f1db16d4c7066fae347e001016a9ebe502711261","expected_engine_artifact_sha256":"aaaaaaaaaaaaaaaaaaaaaaaaaaaaaaaaaaaaaaaaaaaaaaaaaaaaaaaaaaaaaaaa","expected_engine_id":"luremandate-reference","expected_engine_version":"1.0.0","expected_receiver_instance_id":"authority-gateway-instance-1","expected_receiver_key_id":"23b870f8eb429486d3ebab388918350ca0a9b8d5b735c18de5d2ed4ebd6c7211","minimum_run_started_at":"2026-09-05T15:00:00Z"},"producer":{"name":"lurescope","version":"0.11.0"},"schema":"https://github.com/immu4989/lurescope/spec/luremandate-deployment-gate/v1","schema_version":1,"sources":{"authenticated_otel_projection":{"receiver_public_key_sha256":"23b870f8eb429486d3ebab388918350ca0a9b8d5b735c18de5d2ed4ebd6c7211","sha256":"29d4a7f7c07c553d8b0de5d9e96f12d17a47dfbd40362d2e37070be7d36ba493","verification_id":"mandate-run-1-otel-authentication","verified_at":"2026-09-05T15:20:30Z"},"authenticated_verification":{"approver_key_count":4,"authenticated_approval_count":18,"sha256":"3e3d2ec1d5f3bb961737c5728f5acc596d357eea8efac6115ac6df3991516382","verdict":"pass","verification_id":"mandate-run-1-evaluation-authenticated","verified_at":"2026-09-05T15:19:00Z"},"otel_projection":{"generated_at":"2026-09-05T15:20:00Z","record_count":67,"sha256":"c85281a153c7c9557be42de28debba13fbd16d135781f2c9c7dfd013fffb56e7","source_export_sha256":"0cf51b043d3535d2d54e779b1e17460821f96acf3e0ff1f8c5278612be89a6eb"},"semantic_verification":{"sha256":"2cefcd6ac77dacda699e2e5b7760a9fceaf9810ec2804932e4d7685a943f00ca","verdict":"pass","verification_id":"mandate-run-1-evaluation-verification","verified_at":"2026-09-05T15:18:00Z"}}}
